{
  "contract_version": "1.1",
  "dependencies": [
    {
      "pkg": "stata",
      "purpose": "regress command",
      "source": "built-in"
    }
  ],
  "description": "Polynomial regression for nonlinear relationships",
  "family": "linear_regression",
  "id": "TD10",
  "inputs": [
    {
      "name": "data.csv",
      "required": true,
      "role": "main_dataset"
    }
  ],
  "level": "L0",
  "module": "D",
  "outputs": [
    {
      "description": "Polynomial results",
      "file": "table_TD10_poly.csv",
      "type": "table"
    },
    {
      "description": "Polynomial plot",
      "file": "fig_TD10_poly.png",
      "type": "graph"
    },
    {
      "description": "Data file",
      "file": "data_TD10_poly.dta",
      "type": "data"
    },
    {
      "description": "Execution log",
      "file": "result.log",
      "type": "log"
    }
  ],
  "parameters": [
    {
      "description": "Dependent variable",
      "name": "__DEPVAR__",
      "required": true,
      "type": "string"
    },
    {
      "description": "Independent variable",
      "name": "__INDEPVAR__",
      "required": true,
      "type": "string"
    },
    {
      "description": "Polynomial degree (2-5)",
      "name": "__DEGREE__",
      "required": true,
      "type": "integer"
    }
  ],
  "slug": "polynomial",
  "tags": [
    "polynomial",
    "nonlinear",
    "regression"
  ],
  "title": "Polynomial",
  "title_zh": "多项式回归",
  "version": "2.0.1"
}
