{
  "contract_version": "1.1",
  "dependencies": [],
  "description": "Mixture cure survival model (built-in approximation)",
  "family": "survival",
  "id": "TI09",
  "inputs": [
    {
      "name": "data.csv",
      "required": true,
      "role": "main_dataset"
    }
  ],
  "level": "L2",
  "module": "I",
  "outputs": [
    {
      "description": "Cure model results",
      "file": "table_TI09_cure.csv",
      "type": "table"
    },
    {
      "description": "Output data",
      "file": "data_TI09_cure.dta",
      "type": "data"
    },
    {
      "description": "Execution log",
      "file": "result.log",
      "type": "log"
    }
  ],
  "parameters": [
    {
      "description": "Time variable",
      "name": "__TIME_VAR__",
      "required": true,
      "type": "string"
    },
    {
      "description": "Failure indicator",
      "name": "__FAILVAR__",
      "required": true,
      "type": "string"
    },
    {
      "description": "Covariates",
      "name": "__INDEPVARS__",
      "required": false,
      "type": "list[string]"
    }
  ],
  "slug": "stcure",
  "tags": [
    "survival",
    "cure",
    "mixture"
  ],
  "title": "Cure Model",
  "title_zh": "治愈模型",
  "version": "2.0.2"
}
