{
  "contract_version": "1.1",
  "dependencies": [
    {
      "pkg": "xtserial",
      "purpose": "Wooldridge test",
      "source": "ssc"
    }
  ],
  "description": "Test for serial correlation in panel data",
  "family": "panel",
  "id": "TP05",
  "inputs": [
    {
      "name": "data.csv",
      "required": true,
      "role": "main_dataset"
    }
  ],
  "level": "L1",
  "module": "P",
  "outputs": [
    {
      "description": "Output data",
      "file": "data_TP05_serial.dta",
      "type": "data"
    },
    {
      "description": "Execution log",
      "file": "result.log",
      "type": "log"
    },
    {
      "description": "Auto-synced from SS_OUTPUT_FILE anchors",
      "file": "table_TP05_serial_tests.csv",
      "type": "table"
    }
  ],
  "parameters": [
    {
      "description": "Dependent variable",
      "name": "__DEPVAR__",
      "required": true,
      "type": "string"
    },
    {
      "description": "Panel identifier variable",
      "name": "__ID_VAR__",
      "required": true,
      "type": "string"
    },
    {
      "description": "Independent variables",
      "name": "__INDEPVARS__",
      "required": true,
      "type": "list[string]"
    },
    {
      "description": "Time variable for panel setting",
      "name": "__TIME_VAR__",
      "required": true,
      "type": "string"
    }
  ],
  "slug": "panel_serial",
  "tags": [
    "panel",
    "serial_correlation",
    "diagnostics"
  ],
  "title": "Panel Serial Correlation",
  "title_zh": "面板序列相关检验",
  "version": "2.0.1"
}
