{
  "contract_version": "1.1",
  "dependencies": [
    {
      "pkg": "stata",
      "purpose": "lpoly command",
      "source": "built-in"
    }
  ],
  "description": "Local polynomial regression for nonparametric smoothing",
  "family": "advanced_methods",
  "id": "TU13",
  "inputs": [
    {
      "name": "data.csv",
      "required": true,
      "role": "main_dataset"
    }
  ],
  "level": "L2",
  "module": "U",
  "outputs": [
    {
      "description": "Local polynomial fit plot",
      "file": "fig_TU13_lpoly.png",
      "type": "graph"
    },
    {
      "description": "Fitted values",
      "file": "table_TU13_lpoly.csv",
      "type": "table"
    },
    {
      "description": "Output data",
      "file": "data_TU13_lpoly.dta",
      "type": "data"
    },
    {
      "description": "Execution log",
      "file": "result.log",
      "type": "log"
    }
  ],
  "parameters": [
    {
      "description": "Dependent variable",
      "name": "__YVAR__",
      "required": true,
      "type": "string"
    },
    {
      "description": "Independent variable",
      "name": "__XVAR__",
      "required": true,
      "type": "string"
    },
    {
      "description": "Polynomial degree (default 1)",
      "name": "__DEGREE__",
      "required": false,
      "type": "integer"
    },
    {
      "description": "Bandwidth (default auto)",
      "name": "__BANDWIDTH__",
      "required": false,
      "type": "number"
    }
  ],
  "slug": "lpoly",
  "tags": [
    "lpoly",
    "nonparametric",
    "smoothing",
    "local"
  ],
  "title": "Local Polynomial",
  "title_zh": "局部多项式回归",
  "version": "2.0.1"
}
